tweet,time,score,human_score
"[#missing, :, brandon, is, looking, for, his, uncle, [, white, down, pointing, backhand, index, ], [, white, down, pointing, backhand, index, ], [, white, down, pointing, backhand, index, ], #campfirejameswoods, #campfire]",2018-11-12 23:44:24,0.0,
"[blazes, spread, as, a, decimated, town, is, searched, for, bodies, via]",2018-11-12 23:44:23,,
"[revealed, :, kim, and, kanye, paid, private, firefighters, to, save, their, home, from, the, fires]",2018-11-12 23:44:20,,
"[how, to, help, california's, camp, fire, victims, in, paradise, and, nearby]",2018-11-12 23:44:18,,
"[the, malibu, times, is, tracking, buildings, damaged, or, survived, by, the, #woolseyfire]",2018-11-12 23:44:17,,
"[latest, #woolseyfire, story, :, it's, 20, %, contained, ,, with, 91,500, acres, burned, ,, 2, fresh, fires, today, in, simi, valley, .]",2018-11-12 23:44:13,,
"[trump's, misleading, claims, about, california's, fire, ', mismanagement, ']",2018-11-12 23:44:13,,
"[a, view, ,, but, no, home, ., a, longtime, resident, says, more, than, 3, dozen, homes, were, lost, in, #bellcanyon, ., #woolseyfire, .]",2018-11-12 23:44:08,,
"[firefighters, put, out, a, flare-up, fire, along, the, pch, this, morning, in, malibu, ., #woolseyfire]",2018-11-12 23:44:07,,
"[it, seems, ,, kind, of, rude, ,, to, name, a, wildfire, that's, burning, down, homes, and, killing, people, camp, fire, ...]",2018-11-12 23:44:05,,
"[southern, california, folks, :, they, specifically, need, fosters, ,, adopters, and, food, for, large, animals, in, the, wake, of, the, #woolseyfire, ., (, edited, to, correct, previous, tweet, )]",2018-11-12 23:44:02,,
"[camp, fire, death, toll, grows, to, 29, ,, matching, 1933, blaze, as, state's, deadliest, -, east, bay, times]",2018-11-12 23:44:00,,
"[anyone, with, a, missing, family, member, ,, or, those, who, have, located, a, missing, person, can, call, 530-538-6570, ,, 530-538-7544, or, 530-538-7671, ., camp, fire, :, families, desperately, search, for, loved, ones, ,, 228, still, missing]",2018-11-12 23:43:59,,
"[#woolseyfire, #malibu, #california, i, was, just, at, this, wonderful, urgent, care, in, malibu, !, can, anyone, help, ?]",2018-11-12 23:43:55,,
"[camp, fire, :, families, desperately, search, for, loved, ones, ,, 228, still, missing]",2018-11-12 23:43:51,,
"[a, woman, who, owns, land, near, where, the, camp, fire, started, in, northern, california, pg, &, amp, ;, e, sought, access, to, her, property, just, before, the, blaze, started, because, the, power, lines, were, causing, sparks, .]",2018-11-12 23:43:45,,
"[on, behalf, of, those, attending, we, send, our, deepest, thanks, to, #firstresponders, ., thanks, your, ongoing, support, in, the, local, #craftbeer, community, ., our, prayers, are, with, your, staff, ,, family, and, friends, of, those, affected, by, the, #campfire]",2018-11-12 23:43:37,,
"[we, are, missing, guy, edward, prescott, last, seen, paradise, on, clark, road, at, pearson, ,, we, have, not, heard, from, him, since, may, likely, be, in, oroville, or, surrounding, areas, ,, but, we, would, like, to, know, that, he, is, ok, ...., #campfire, #campfirejameswoods]",2018-11-12 23:43:35,,
"[our, hearts, go, out, to, our, fellow, jewish, camps, who, have, been, impacted, by, the, #woolseyfire, :, ,, camp, hess, kramer, and, gindling, hilltop, camp, ., we, are, in, this, together, ., full, update, here, :]",2018-11-12 23:43:35,,
"[urgentplease, retweet, [, white, down, pointing, backhand, index, ], [, emoji, modifier, fitzpatrick, type, -1-2, ], [, white, down, pointing, backhand, index, ], [, emoji, modifier, fitzpatrick, type, -1-2, ], immediate, evacuation, orderareas, of, #boxcanyon, and, #lakemanor, ,, unincorporated, #losangeles, ., #dayfive, #californiawildfires, ., #campfirejameswoods, #socalfiresjameswoods, #woolseyfire, #campfire]",2018-11-12 23:43:29,0.0,
"[here, is, a, link, if, u, would, like, donate, to, my, family, ., my, nana's, venmo, is, @, mary-jarschke, ., our, family, like, thousands, of, others, lost, their, house, in, #campfire, ., thank, you, to, those, who, have, already, helped, us, ,, reached, out, to, us, and, have, been, thinking, of, us, ., [, heavy, black, heart, ], [, ?, ], [, person, with, folded, hands, ], [, emoji, modifier, fitzpatrick, type, -, 3, ]]",2018-11-12 23:43:29,1.0,
"[waiting, for, spring, !, #campground, #camping, #207, #maine, #naplesmaine, #trickeypond, #vacationland, #tenting, #rving, #newengland, #thewaylifeshouldbe, #camplife, #campfire, #mainewelcomesyou, ...]",2018-11-12 23:43:24,,
"[the, baseball, field, at, the, high, school, behind, my, house, ., somehow, the, only, thing, touched, in, my, immediate, surrounding, area, in, the, #woolseyfire]",2018-11-12 23:43:24,,
"[camp, fire, haze, affects, chargers, and, raiders]",2018-11-12 23:43:24,,
"[children, shouldn't, play, with, twitter, ., [, man, ], [, zero, width, joiner, ], [, fire, engine, ], [, woman, ], [, zero, width, joiner, ], [, fire, engine, ], #campfire]",2018-11-12 23:43:24,,
"[i'm, raising, money, for, leaha, bruno-starting, over, ., click, to, donate, :, via, #campfire, #campfireparadise, #campfirebutte]",2018-11-12 23:43:21,,
"[there, are, 200, california, inmates, fighting, the, camp, fire, ., after, prison, ,, they, likely, won't, be, allowed, to, become, firefighters, -, ...]",2018-11-12 23:43:00,,
"[#trumplies, :, science, shows, winds, and, drought, worsen, fires, ,, not, bad, management, #resist, #resistance, #trumpsmentalhealth, #theimmoralgop, #wildfires, #californiafires, #californiawildfires, #campfire, #trump, #trumpcrimes, #trumpevil, #fascism, #trumpfascism]",2018-11-12 23:42:59,,
"[#tuesdaythoughts, camp, fire, matches, deadliest, wildfire, in, california's, history, as, death, toll, climbs, to, 29]",2018-11-12 23:42:56,,
"[#trump's, misleading, claims, about, california's, fire, ', mismanagement, ', :, new, york, times, #environment, |, more, on, web, :]",2018-11-12 23:42:54,,
"[omg, !, [, horse, ], hasn't, evacuated, the, animals, (, incl, ., stanley, the, giraffe, ), ,, yet, their, property, is, on, fire, ., please, sign, this, petition, to, get, them, safely, transferred, to, a, new, location, !, #woolseyfire, via]",2018-11-12 23:42:53,,
"[very, cool, !, !, #woolseyfire, #hillfire, #venturacounty, #losangelescounty]",2018-11-12 23:42:45,,
"[trump's, misleading, claims, about, california's, fire, ', mismanagement, ', via]",2018-11-12 23:42:42,,
"[abc, 7, over, the, #woolseyfire, currently, live, @, links, :, (, ventura, co, ), (, la, county, ), #campfire, :, (, focused, on, air, tanker, traffic, mostly, ), ., flight, radar, :]",2018-11-12 23:42:38,,
"[!, !, #woolseyfire, closure, !, !, the, road, is, shutdown, in, #pacificpalisades, on, pacific, coast, hwy, nb, between, sunset, blvd, and, after, las, posas, rd]",2018-11-12 23:42:36,,
"[today, ,, i, went, to, paradise, again, to, further, assess, the, devastation, ., the, loss, of, lives, and, properties, is, beyond, belief, ., thank, you, all, to, the, brave, firefighters, ,, law, enforcement, and, personnel, who, are, here, to, help, our, fellow, citizens, ., #campfire]",2018-11-12 23:42:35,,
"[more, than, 3,000, firefighters, have, been, waging, an, all-out, attack, on, the, #woolseyfire, ., the, raging, flames, have, scorched, almost, 150, square, miles, -, -, 370, structures, have, been, lost, ,, yet, fire, officials, say, crews, saved, 57,000, homes, ., reports]",2018-11-12 23:42:33,,
"[omg, ., terrible, ., aftermath, of, the, california, fire, (, disturbing, )]",2018-11-12 23:42:33,,
"[pulitzer, prize, winning, journalists, explain, why, #campfire, was, not, caused, by, bad, forest, management, (, trump's, bullshit, claim, ), ,, but, rather, that, it, was, caused, by, a, lack, of, government, regulation, .]",2018-11-12 23:42:33,,
"[with, just, a, little, bit, of, drying, you, get, a, substantial, increase, in, the, amount, of, burning, ., note, the, distances, covered, by, the, #campfire, and, #woolseyfire, in, 24, hrs, .]",2018-11-12 23:42:26,,
"[burned, out, northern, california, fire, victim, questions, directed, energy, weapons]",2018-11-12 23:42:23,,
"[the, new, multi, million, dollar, ', gateway, to, calabasas, ', lost, hills, overpass, is, still, looking, good, after, the, fire, ,, all, things, considered, .., #woolseyfire]",2018-11-12 23:42:20,,
"[#woolseyfire, flare, ups, between, kanann-dume, rd, and, yerba, buena, rd, in, malibu, as, seen, from, #newburypark, looking, southeast, ,, timelapse, taken, afternoon, of, nov, 10, ,, 2018, ,, during, supposedly, calm, winds, .]",2018-11-12 23:42:19,,
"[this, nigga, started, the, california, fire]",2018-11-12 23:41:57,,
"[be, thoughtful, about, what, you're, donating, -, money, and, gift, cards, are, more, flexible, and, easier, to, distribute, than, miscellaneous, supplies, ..., #campfire, #woolsleyfire]",2018-11-12 23:41:56,,
"[we, are, on, our, way, to, the, monster, #campfire, that's, now, gown, to, 113,000, acres, and, is, just, 25, %, contained, ., today, variable, winds, pose, a, big, threat, to, firefighters, and, fire, growth, .]",2018-11-12 23:41:53,,
"[critical, fire, danger, for, most, of, california, as, wind, advisories, kick, in, ., reports, .]",2018-11-12 23:41:52,,
"[look, at, the, poor, air, quality, in, #sacramento, due, to, the, #californiawildfires, #paradise, #buttecounty, #prayforcalifornia, #campfire]",2018-11-12 23:41:49,,
"[thank, you, to, all, of, the, fire, fighters, ,, police, ,, emt's, ,, doctors, &, amp, ;, nurses, who, risk, their, lives, to, keep, the, community, safe, ., we, extend, our, deep, gratitude, to, all, of, those, working, so, hard, to, save, people, ,, animals, and, homes, ., #woolseyfire]",2018-11-12 23:41:48,,
"[trump's, (, impulsive, reactive, vindictive, unsubstantiated, lies, totally, lacking, care, compassion, and, empathy, ), ., misleading, claims, about, california's, fire, ', mismanagement, ', -, the, new, york, times]",2018-11-12 23:41:46,,
"[i'm, coughing, over, 90, miles, south, ., strong, smell, of, smoke, inside, at, home, .]",2018-11-12 23:41:43,,
"[the, red, cross, says, volunteers, from, western, states, are, heading, to, #campfire, area, ,, as, aid, groups, try, to, provide, shelter, for, victims, .]",2018-11-12 23:41:43,,
"[paradise, [, broken, heart, ], #campfire, #californiawildfires]",2018-11-12 23:41:35,0.0,
